Имя пользователя,Ссылка,Время,Текст,Хэштеги
IBTimes.ru,@IbtimesRUS,28 мая 2020 г.,Минздрав рекомендовал не включать в статистику заболевших COVID-19 при отсутствии жалоб,
Сделано в Германии,@DeHergestelltin,28 мая 2020 г.,"Министерство здравоохранения #германия отдало назад миллионы таблеток от малярии концерну Bayer,которые получили как гуманитарную помощь. Было доказано,что эти медикаменты не помогают от #коронавирус,а наоборот могут провоцировать преждевременную смерть пациента.",#коронавирус
𝕷𝖆𝖓𝖆 𝕾𝖆𝖗𝖆𝖙𝖔𝖛 * Z * * V *,@LanaSaratov,28 мая 2020 г.,Билет в один конец: COVID-19 «обнулит» Латвию?,
jromanova,@jromanova3,28 мая 2020 г.,"Весело выходит, если честно: ",
Анна,@MBAlPF8qRfT2JO6,28 мая 2020 г.,Я оценилa городскую новинку «Более 540 доноров сдали плазму для лечения пациентов с COVID-19» в проекте «Активный гражданин»,
Нижний Новгород,@Online_NN,28 мая 2020 г.,Минздрав решил победить COVID-19 в России статистикой,
ACHTUNG PARTISANEN,@EuropeanFront,28 мая 2020 г.,ВОЗ не рекомендует использование гидроксихлорохина в качестве лекарства от COVID-19 https://achtungpartisanen.ru/voz-ne-rekomenduet-ispolzovanie-gidroksihlorohina-v-kachestve-lekarstva-ot-covid-19/…,
RusNext РусскаяВесна,@rusnextru,28 мая 2020 г.,"Граждан, у которых выявлен коронавирус, но нет жалоб, не стоит включать в официальную статистику по заболеваемости COVID-19. #МинздравРФ #Коронавирус #РусскаяВесна #RusNext",#коронавирус
Новости Крыма,@newsallcrimea,28 мая 2020 г.,Севастопольские ученые считают небольшим риск заражения COVID-19 в море http://dlvr.it/RXSv6N,
Хуёвые Вести:,@nickotin,28 мая 2020 г.,К параду? ,
Stavropolnews.ru,@stavropolnews,28 мая 2020 г.,"27 мая 2020 года в Ставропольском крае зарегистрировано 2158 случаев коронавирусной инфекции COVID-19 - ИИ Ставропольские новости, 27.05.2020 - 20:59 https://stavropolnews.ru/news/obshchestvo-zdorove/27-maya-2020-goda-v-stavropolskom-krae-zaregistrirovano-2158-sluchaev…",
Mini_Olka,@MiniOlka,28 мая 2020 г.,"Интересно когда люди уже поймут, что самоизоляция и маски защищают не от штрафа, а от COVID-19?",
Мир 24,@Mir24TV,28 мая 2020 г.,"В Москве с июня откроются парки, ярмарки выходного дня и спортобъекты ",
ИА REGNUM,@IA_REGNUM,28 мая 2020 г.,Так ли страшен COVID-19 и кто заинтересован в панике? – все новости https://regnum.ru/news/2919961,
bekmurat,@btd4580000,1 авг. 2020 г.,"Олин сказал, что, когда они узнали о положительном результате, школа ввела свой ""положительный протокол тестирования Covid-19"".” Операция ""Скорость деформации"", многомиллиардная программа федерального правительства по вакцинам Covid-19,",
РЕН ТВ | Новости,@rentvchannel,1 авг. 2020 г.,"Глава РФПИ Кирилл Дмитриев сообщил, что Россия исторически лидировала в разработках препаратов, поэтому Москве удалось столь быстро разработать вакцину от COVID-19",
bekmurat,@btd4580000,1 авг. 2020 г.,"Поскольку школьный округ Индианы вернулся к очному обучению в первый день 2020-21 учебного года, один из его учеников дал положительный результат на Covid-19, согласно письму, отправленному родителям.",
bekmurat,@btd4580000,1 авг. 2020 г.,в четверг вечером во время коронавирусного таунхолла Си-эн-эн. Студенческие тесты дали положительный результат на Covid-19 в первый день учебы в Индиане От Ребекки Рисс из Си-эн-эн.,
healthqlab,@igor4med,1 авг. 2020 г.,"США заплатит Sanofi и GSK 2,1 млрд долларов за вакцину от COVID-19 http://healthqlab.ru/ssha-zaplatit-sanofi-i-gsk-2-1-mlrd-dollarov-za-vakcinu-ot-covid-19/…",
Новости Находки,@newsnhkpk,1 авг. 2020 г.,Новая статья (По итогам месяца количество выявленных заболевших COVID-19 в Приморье выросло на 58%) была опубликована на сайте Находка News - ,
beautyMari,@beautyMarionly,1 авг. 2020 г.,"Что в обществе?  ""Ослабили бдительность"": кого винят в новых вспышках COVID-19",
Архнет.Инфо,@ArhnetInfo,1 авг. 2020 г.,#АрхнетИнфо,
Наш город Тюмень,@nashgorod,1 авг. 2020 г.,В Тобольске на 28 июля врачи зарегистрировали пятерых зараженных COVID-19 ,
Rostyslav,@Iam_Rostyslav,1 авг. 2020 г.,ВОЗ зафиксировала новый рекорд по числу случаев COVID-19 за сутки: https://rbc.ru/society/01/08/2020/5f2489819a79471d91370281… за допомогою ,
Пенза Взгляд / ПВ,@penzavzglyad,1 авг. 2020 г.,"Новые случаи COVID-19, исчезновение женщины и выплаты на детей: новости за 31 июля ",
72.RU,@72ru,1 авг. 2020 г.,"Эффективна на 100%: у всех добровольцев, испытавших российскую вакцину от COVID-19, выработался иммунитет ",
ProZakon24.ru,@Prozakon24Ru,1 авг. 2020 г.,В Узбекистане выявили рекордное число случаев COVID-19 за сутки https://goo.gl/fb/Qfv72J,
jan,@chirkove,1 авг. 2020 г.,"Срочно! Еще 390 случаев заражения Covid-19 за сутки https://news.mail.ru/incident/42795265/?social=tw… Жертвами COVID-19 стали 778 в РМ, а где остальная статистика по смертности в Молдове? - народ хочет знать, сколько умирает людей от остальных болезней? - или не умирает?",
Jenkers News (RUS),@jenkers_ru,1 авг. 2020 г.,В Москве за сутки умерли еще 13 пациентов с #коронавирус'ом http://jenke.rs/s9F0Ah,#коронавирус
Префектура ЗАО г. Москвы,@IfIc6CQAFmvx86S,1 авг. 2020 г.,Эксперт: начало периода отпусков может влиять на статистические колебания заболеваемости COVID-19 https://na-zapade-mos.ru/ehkspert-nachalo-perioda-otpuskov-mozhet-vlijat-na-statisticheskie-kolebanija-zabolevaemosti-cov19…,
ЭХО Киева,@_echoua_,1 авг. 2020 г.,Украина разделена на 4 зоны по уровню распространения COVID-19. В «красную» зону попало 3 региона: Центральная комиссия по вопросам техногенно-экологической безопасности и чрезвычайных ситуаций на заседании определила регионы по уровню распространения… http://dlvr.it/Rcmd8l,
ACHTUNG PARTISANEN,@EuropeanFront,1 авг. 2020 г.,Российская вакцина от COVID-19 сформировала иммунитет у 100% добровольцев https://achtungpartisanen.ru/rossiyskaya-vaktsina-ot-covid-19-sformirovala-immunitet-u-100-dobrovoltsev/…,
jan,@chirkove,1 авг. 2020 г.,Когда ждать вторую волну COVID-19: что заявили в Минздраве https://news.mail.ru/incident/42797697/?social=tw… капец - врут и глазом не моргают,
rgrus,@rgrus,1 авг. 2020 г.,Российская вакцина от COVID-19 сформировала иммунитет у 100% добровольцев https://rg.ru/2020/08/01/rossijskaia-vakcina-ot-covid-19-sformirovala-immunitet-u-100-dobrovolcev.html…,
EHB,@novostivlru,1 авг. 2020 г.,Вьетнам сообщил о самом большом скачке случаев COVID-19,
Дмитрий,@dumuch_new,1 авг. 2020 г.,Белокуриха приглашает переболевших COVID-19 восстановить здоровье https://goo.gl/fb/VrgBsN,
KP.RU - Казань,@kazanKPru,1 авг. 2020 г.,"Коронавирус в Ульяновской области, последние новости на 1 августа 2020 года: заразились еще 110 человек",
KP.RU - Ставрополь,@StavKP,1 авг. 2020 г.,"Коронавирус в Ставропольском крае, ситуация на 1 августа 2020: COVID-19 заразились еще свыше ста человек",
Just curious,@JustCuriousOlga,1 авг. 2020 г.,"Главный исполнительный директор Siemens Digital Industries, член правления «Сименс АГ» Клаус Хельмрих убежден: чтобы адаптироваться к текущим условиям, промышленным компаниям необходимы #цифровизация и #автоматизация. #Сименс #Covid19",#covid #covid19
Дмитрий Бузанов,@advocate_trump,1 авг. 2020 г.,В ответ ,
Leon Rozenberg,@LRozenberg,1 авг. 2020 г.,Поддерживаемые Китаем хакеры 'нацелены на вакцинную фирму COVID-19 Moderna' - Наука и здоровье - http://Haaretz.com,
Vad,@Vad20053011,1 авг. 2020 г.,Про детей и covid-19. Они  получают его и переносят с разными вариациями: с симптоматикой и без.,
Pressapro.ru,@pressapro,1 авг. 2020 г.,В Москве за сутки скончались 13 пациентов с COVID-19 https://pressapro.ru/obshhestvo/v-moskve-za-sytki-skonchalis-13-pacientov-s-covid-19/…,
Максим Сотков,@msotkov,1 авг. 2020 г.,Горячая линия COVID-19 предлагает сдавать анализ за свой счёт.,
Слава українському Криму,@nvAiOL22V3rq6oG,1 авг. 2020 г.,COVID-19 в Крыму: новый виток заболеваемости (обновлено),
Replaye RU,@ReplayeRu,1 авг. 2020 г.,В Москве за сутки умерли 13 пациентов с коронавирусом,
ИА REGNUM,@IA_REGNUM,1 авг. 2020 г.,В Марокко выявили больше тысячи случаев COVID-19 за сутки https://regnum.ru/news/3025868,
Подпись неразборчива,@Nabludatelnits1,1 авг. 2020 г.,В ответ ,
Janakinatha,@vybuwifymuv,1 авг. 2020 г.,Более 10 миллионов человек в мире излечились от COVID-19,
Эдуард Темнов,@ETemnov,1 авг. 2020 г.,Рекомендации Роспотребнадзора России по профилактике новой коронавирусной инфекции (COVID-19) в образовательных организациях высшего образования от 29 июля 2020 года № МР 3.1/2.1.0205-20 https://bit.ly/3glj4og,
Новини України/Новости Украины,@InfoProstirUA,1 авг. 2020 г.,Во Франции ухудшается ситуация с коронавирусом,
Мир 24,@Mir24TV,1 авг. 2020 г.,Глава РФПИ: У всех добровольцев появился иммунитет к коронавирусу https://mir24.tv/news/16420238/u-vseh-dobrovolcev-poyavilsya-immunitet-k-koronavirusu… #коронавирус #вакцина #иммунитет #ковид #РФПИ #здоровье #новости #мир24,#коронавирус #ковид
Радио Стыдоба,@RadioStydoba,1 авг. 2020 г.,"Более 70% американцев негативно относятся к Китаю, так как возлагают на него вину за распространение COVID-19 в мире. Такие результаты показал опрос Pew Research Center.",
Queen of Motorsport,@Queen_of_Motor,1 авг. 2020 г.,http://queen-of-motorsport.ru/formula-1/peres-edinstvennyj-polozhitelnyj-sluchaj-na-covid-19-posle-poslednego-etapa-testirovaniya…,
Радмир,@Radmir_R11,1 авг. 2020 г.,https://airfunding.net/project/65023?hl=ru&utm_source=twitter&utm_medium=social&utm_campaign=project_first_shares&utm_content=project_id_65023… #AirtrippFunding #Помощь во время COVID-19 через ,
Кавказский Узел,@caucasianknot,1 авг. 2020 г.,Армения вернула лидерство по приросту зараженных COVID-19 на Южном Кавказе https://ift.tt/315g7lw,
ZdravMedInfo,@ZdravMedInfo,1 авг. 2020 г.,Путин ускорил процедуру выдачи страховых выплат заболевшим COVID-19 медикам http://zdravmedinfo.com/mednews.html?article=154247…,
Финансовое обозрение,@finoboz,1 авг. 2020 г.,Госкомиссия по ТЭБ и ЧС установила новые уровни эпидемической опасности распространения COVID-19 в Украине - https://finoboz.net/politics/goskomissiya-po-teb-i-chs-ustanovila-novye-urovni-epidemicheskoj-opasnosti-rasprostraneniya-covid-19-v-ukraine/… #финансы #Украина #бизнес,
ИА REGNUM,@IA_REGNUM,1 авг. 2020 г.,Жертвами COVID-19 в ЮАР стали более 8000 человек https://regnum.ru/news/3025865,
Новини України/Новости Украины,@InfoProstirUA,1 авг. 2020 г.,"Трамп заявил, что Китай должен заплатить за пандемию",
ZdravMedInfo,@ZdravMedInfo,1 авг. 2020 г.,Выпущены клинические рекомендации по COVID-19 при ревматических заболеваниях http://zdravmedinfo.com/mednews.html?article=154301…,
CZNews.info,@CzNewsInfo,1 авг. 2020 г.,Евросоюз зарезервировал 300 миллионов доз вакцины от covid-19,
Известия,@izvestia_ru,1 авг. 2020 г.,,
ProMED_RUS,@ProMED_RUS,1 авг. 2020 г.,"PRO/RUS> COVID-19 (на 22:50 МСК 17.644.825 случаев, 679.925 умерших, 11.037.056 выздоровевших) (178)  http://zpr.io/H7SgH",
ZdravMedInfo,@ZdravMedInfo,1 авг. 2020 г.,Минздрав адаптировал рекомендации по реабилитации пациентов после COVID-19 http://zdravmedinfo.com/mednews.html?article=154214…,
Новости Украины,@uatime_net,1 авг. 2020 г.,Госкомиссия по ТЭБ и ЧС установила новые уровни эпидемической опасности распространения COVID-19 в Украине - https://uatime.net/world/goskomissiya-po-teb-i-chs-ustanovila-novye-urovni-epidemicheskoj-opasnosti-rasprostraneniya-covid-19-v-ukraine/… #Киев #Новости #Украина,
ZdravMedInfo,@ZdravMedInfo,1 авг. 2020 г.,AstraZeneca не будет отвечать за побочные эффекты вакцины против COVID-19 в большинстве стран http://zdravmedinfo.com/pharmnews.html?article=154279…,
Крым.Реалии,@krymrealii,1 авг. 2020 г.,Россия ограничивает передвижение крымчан под предлогом борьбы с COVID-19 – посол Украины в ОБСЕ https://bit.ly/2PcNX2n,
ZdravMedInfo,@ZdravMedInfo,1 авг. 2020 г.,Johnson & Johnson начинает КИ вакцины-кандидата против COVID-19 http://zdravmedinfo.com/pharmnews.html?article=154267…,
Інша Україна,@inshaua,1 авг. 2020 г.,Трамп о пандемии COVID: Китай должен заплатить,
ZdravMedInfo,@ZdravMedInfo,1 авг. 2020 г.,Эксперт: стоимость вакцины от COVID-19 будет зависеть от технологии производства http://zdravmedinfo.com/pharmnews.html?article=154259…,
Тимурио,@m_stafff,1 авг. 2020 г.,"А вы думали , что маска не помогает ? Держите пруф и соблюдайте дистанцию! #аниме #наруто #коронавирус #COVIDー19",#covid #коронавирус
Городской портал Kursk.com,@kurskcom,1 авг. 2020 г.,В горбольнице №2 Белгорода уберут койки для зараженных COVID-19  http://kursk.com/news/blackearth/52304.html…,
Aban lam,@Abama2011,1 авг. 2020 г.,"Врачи считают, что вторая волна COVID-19 может совпасть с сезонной вспышкой ОРВИ https://smart-smi.ru/single/94670",
Лилия Мукулова,@Lilia_Mukulova,1 авг. 2020 г.,Ольга Вилар - Укрощение нага. Читать на Литмаркет https://litmarket.ru/books/ukroshchenie-naga… #наги #приключения #сложные отношения,
Лилия Мукулова,@Lilia_Mukulova,1 авг. 2020 г.,Ольга Вилар - Видящая ангелов. Читать на Литмаркет https://litmarket.ru/books/vidyashchaya-angelov-1… #приключения #фэнтези #адекватная героиня,
Московский Комсомолец,@mkomsomolets,1 авг. 2020 г.,В Москве за сутки скончались 13 пациентов с COVID-19,
Высота102,@v102ru,1 авг. 2020 г.,Волгоградский «Ротор» перед матчем с «Зенитом» сыграет с ЦСКА https://v102.ru/news/90107.html #волгоградновости #Волгоград_Арена #футбол #Ротор #Зенит #ЦСКА #стадион #тренировка #команда #Тинькофф #коронавирус #сидимдома #болельщики #Высота102 #Волгоград #В102,#коронавирус
Лилия Мукулова,@Lilia_Mukulova,1 авг. 2020 г.,Ольга Вилар - Путь домой. Читать на Литмаркет https://litmarket.ru/books/put-domoy #рабство #сложные отношения #эльфы,
Друзья космонавтики,@tostarstogether,1 авг. 2020 г.,"Это будет первый пуск из Французской Гвианы с февраля 2020 года. Пусковой оператор Arianespace , осуществляющий пуски ракет-носителей #Ariane5, #СоюзСТ и #Vega, был вынужден в марте приостановить работы в Гвианском космическом центре #GSC из-за пандемии коронавируса #COVID19.",#covid #covid19
Press__MO,@Press__MO,1 авг. 2020 г.,"С этого года у фестиваля появился оргкомитет и худрук - народный артист СССР Юрий Башмет. Под его руководством концертная программа стартовала бесплатным концертом  для врачей и волонтеров, работавших в больными COVID-19.",
Лилия Мукулова,@Lilia_Mukulova,1 авг. 2020 г.,Ольга Вилар - В лабиринтах сумерек. Читать на Литмаркет https://litmarket.ru/books/v-labirintah-sumerek… #постапокалипсис #приключения #сильный ,
Лилия Мукулова,@Lilia_Mukulova,1 авг. 2020 г.,Ольга Вилар - Истинная для эльфа. Читать на Литмаркет https://litmarket.ru/books/istinnaya-dlya-elfa… #истинная пара #эльфы #путешествия и бои,
Телеканал 360°,@360tv,1 авг. 2020 г.,В Москве за сутки скончались 13 пациентов с коронавирусом. Общее число жертв COVID-19 в столице достигло 4473.,
Церковное Обозрение,@church_review,1 авг. 2020 г.,"Украина готовится к массовой вакцинации от COVID-19, – Минздрав",
BALTNEWS,@BALTNEWS1,1 авг. 2020 г.,"""Браво"" правительству! Литва стала лидером Прибалтики по числу заражений Covid-19",
ppfood,@ppfoodru,1 авг. 2020 г.,"Почему рост заболевших Covid-19 растет, но смертность падает? - http://ppfood.ru/pochemu-rost-zabolevshix-covid-19-rastet-no-smertnost-padaet/…",
Лилия Мукулова,@Lilia_Mukulova,1 авг. 2020 г.,Ольга Вилар - Одиссея морского дракона. Читать на Литмаркет https://litmarket.ru/books/odisseya-morskogo-drakona… #драконы #морские приключения #мертвецы,
Смотри HD online,@Kino_HD_Online,1 авг. 2020 г.,COVID-19 бьет рекорды: почти 300 тысяч заболевших за сутки,
Жаб Лягушинский,@7777777ok,1 авг. 2020 г.,31 июля 2020 г.,
presshub_ru,@presshubeu,1 авг. 2020 г.,Великобритании  [iz]  #Перес пропустит Гран-при #великобритании из-за заражения COVID-19 http://presshub.eu/ru/articledetails.aspx?aid=6968059&pg=1#presshubeu…,
Cобытия дня в России,@smnewsru,1 авг. 2020 г.,"Доктор Мясников дал 7 рекомендаций, как избежать тяжелого течения коронавируса",
Maxim Okulov,@Kiprinform,1 авг. 2020 г.,Covid-19: 25 новых случаев https://ift.tt/3gjcBtY,
vokasrok,@igorigor346350,1 авг. 2020 г.,Опасная суета: почему преждевременная вакцинация от COVID-19 может закончиться катастрофой,
Хуйовый Краснодон,@xy_krasnodon,1 авг. 2020 г.,"""Украину по уровню распространения COVID-19 поделили на красную, желтую, оранжевую и зеленую зоны""",
Лилия Мукулова,@Lilia_Mukulova,1 авг. 2020 г.,Ольга Вилар - Баланс на Грани. Читать на Литмаркет https://litmarket.ru/books/balans-na-grani… #некромант #сильный герой #ангелы и демоны,
Igor Mylnikov,@IgorMylnikov,1 авг. 2020 г.,Минпросвещения не выявило случаев заражения COVID-19 в детских лагерях – Культура Отдых – http://Neva.Today http://rviv.ly/hDPZqU,
ОстроВ,@ostro_v,1 авг. 2020 г.,"Украину по уровню распространения COVID-19 поделили на красную, желтую, оранжевую и зеленую зоныhttp://ostro.org/general/economics/news/594679/…",
РБК,@ru_rbc,1 авг. 2020 г.,"Власти Великобритании в связи со второй волной COVID-19 объявили, что пока не будут смягчать эпидемиологический режим. Так поступили еще несколько стран. Какая ситуация в мире — в обзоре РБК https://rbc.ru/politics/31/07/2020/5f23f9e89a7947dc9411e29d?utm_source=tw_rbc…",
Лилия Мукулова,@Lilia_Mukulova,1 авг. 2020 г.,Ольга Вилар - Не ангелы-2. Читать на Литмаркет https://litmarket.ru/books/ne-angely-2… #ангелы и демоны #драконы #приключения,
Punk2441,@punk2441,1 авг. 2020 г.,Бегущие по лезвию... #covid19 #sarscov2,#covid #covid19
Интерфакс-Украина,@interfaxua,1 авг. 2020 г.,Последствия пандемии COVID-19 будут ощущаться десятилетиями - глава ВОЗ,
