Имя пользователя,Ссылка,Время,Текст,Хэштеги
rgrus,@rgrus,21 апр. 2020 г.,Упрощен беспошлинный ввоз медицинских товаров для борьбы с COVID-19 https://rg.ru/2020/04/20/uproshchen-besposhlinnyj-vvoz-medicinskih-tovarov-dlia-borby-s-covid-19.html…,
rgrus,@rgrus,21 апр. 2020 г.,"Ученые исследуют пептид, который мог бы блокировать COVID-19 https://rg.ru/2020/04/20/reg-szfo/uchenye-issleduiut-peptid-kotoryj-mog-by-blokirovat-covid-19.html…",
Новости Асбеста,@AsbestGid,21 апр. 2020 г.,"Полицейский в Екатеринбурге получил ножевое ранение во время госпитализации больного COVID-19, сообщил журналистам в понедельник глава пресс-службы ГУМВД по Свердловской области Валерий Горелых.",
Патриот,@storonnik2010,21 апр. 2020 г.,Об этой цели пандемии COVID-19 никто публично не говорит,
АТН: Новости,@atnbtrc,21 апр. 2020 г.,"Резиденты Парка высоких технологий, Wargaming и EPAM передали Минздраву 700 000 фильтрующий масок высокого класса защиты, которые были рекомендованы ВОЗ. Уже завтра респираторы отправятся в больницы, которые оказывают помощь пациентам с COVID-19. ",
RusNext РусскаяВесна,@rusnextru,21 апр. 2020 г.,"Чиновники заявляют, что оставшиеся не у дел сотрудники отрасли будут получать государственные пособия. #Испания  #Коронавирус #РусскаяВесна #RusNext",#коронавирус
中国驻白俄罗斯大使馆,@ZhongBai2020,21 апр. 2020 г.,"Помощь китайских компаний Беларуси для борьбы с COVID-19 превысила $1,6 млн",
78 | НОВОСТИ,@good78news,21 апр. 2020 г.,Военнослужащие провели спецобработку Главного штаба и Академии СК РФ в Петербурге: https://78.ru/news/2020-04-20/voennosluzhashie_proveli_specobrabotku_glavnogo_shtaba_i_akademii_sk_rf_v_peterburge…,
78 | НОВОСТИ,@good78news,21 апр. 2020 г.,"Пик распространения коронавируса в Петербурге наступит в июне, заявил главный врач клинической инфекционной больницы имени Боткина Денис Гусев: https://78.ru/news/2020-04-20/glavvrach_bolnici_botkina_kolichestvo_bolnih_koronavirusom_budet_uvelichivatsya…",
Техподдержка RU,@linuxesrf,21 апр. 2020 г.,Самоизоляцию продлят до июня? https://tehpodderzka.ru/2020/04/samoizol.html…,
Бессонная редакция,@ferraru,21 апр. 2020 г.,"Учёные нашли причину, по которой COVID-19 протекает тяжелее у людей с ожирением",
AA Macedonian,@aa_macedonian,21 апр. 2020 г.,Во #Франција од #Ковид-19 досега #починаа 18.681 #лице,#ковид
Dr. Elena Mikhailova,@ElenaMikhailova,21 апр. 2020 г.,"Я ужасно страдаю от того, что  из-за #COVID19 не могу пойти на плановую чистку зубов к своей любимой дантистке-гигиенистке. Ассоциация дантистов Онтарио запретила им приём пациентов. Только с острой болью. #жизньболь",#covid #covid19
Давид Касаев,@david83579,21 апр. 2020 г.,Торговцев автомобилями признали пострадавшими от COVID-19 - http://Perevozki-stolitsa.ru,
V Z - Взгляд,@vzglyad,21 апр. 2020 г.,Мишустин упростил беспошлинный ввоз в Россию медтоваров для борьбы с COVID-19,
Человек Ноября,@ManOfNovember,21 апр. 2020 г.,Доктор Мясников сообщил о перенесенном им COVID-19.  РБК.,
ACHTUNG PARTISANEN,@EuropeanFront,21 апр. 2020 г.,Роспотребназдор спрогнозировал рост заражений COVID-19 в Северной Осетии https://achtungpartisanen.ru/rospotrebnazdor-sprognoziroval-rost-zarazheniy-covid-19-v-severnoy-osetii/…,
Отырар KZ қазақша,@otyrarkz,21 апр. 2020 г.,"Шымкентте ""COVID-19"" инфекциясын жұқтырғандар 90-ға жетті - https://kz.otyrar.kz/2020/04/shymkentte-covid-19-infektsiyasyn-zh%d2%b1%d2%9btyr%d2%93andar-90-%d2%93a-zhetti/…",
НАТО по-русски,@NATOpoRusski,21 апр. 2020 г.,.,
kremenchug.ua,@kremen_ua,21 апр. 2020 г.,2 новых подтверждённых случая заболевания COVID-1…  https://kremenchug.ua/news/health/50585-2-novyh-podtverzhdennyh-sluchaja-zabolevanija-covid-19-za-sutki-v-poltavskoj-oblasti.html…,
Jenkers News (RUS),@jenkers_ru,21 апр. 2020 г.,#Facebook разработал карту с данными о числе людей с симптомами #COVID-19 http://jenke.rs/Gn0f8N,#covid #covid-19
Павел,@Ppavel13,21 апр. 2020 г.,«Это еще даже не начало». Вирусолог считает целесообразным два года карантина на Украине,
BALTNEWS,@BALTNEWS1,21 апр. 2020 г.,"COVID-19 объединит все страны мира, но конкуренция сохранится – эстонский политолог",
Oleg Artemyev,@OlegMKS,21 апр. 2020 г.,Эпидемиологическая ситуация в мире внесла определённые коррективы в проведение традиционных пред-и-послеполётных мероприятий. Подробнее по ссылке https://instagram.com/p/B_NaZoBH_8D/,
ANADOLU AGENCY (RU),@aa_russian,21 апр. 2020 г.,"Вслед за объявлением пандемии коронавируса нового типа (#Covid19), многие страны начали принимать меры по противодействию распространения опасной болезни. Система здравоохранения стран, наиболее сильно пострадавших от пандемии, столкнулась с серьезным вызовом. ",#covid #covid19
ppfood,@ppfoodru,28 мая 2020 г.,Минздрав разъяснил принцип включения в статистику заболеваемости COVID-19 - http://ppfood.ru/minzdrav-razyasnil-princip-vklyucheniya-v-statistiku-zabolevaemosti-covid-19/…,
chernigov.org,@ChernigovOrg,28 мая 2020 г.,Коронавирус: сколько в Украине пограничников болеют COVID-19 https://chernigov.org/korrupcia/koronavirus-skolko-v-ukraine-pogranichnikov-bolejut-covid-19/…,
Московский Комсомолец,@mkomsomolets,28 мая 2020 г.,"Куклачев пояснил, что делать с заразившейся COVID-19 кошкой",
Jenkers News (RUS),@jenkers_ru,28 мая 2020 г.,В #Чили число зараженных #коронавирус'ом превысило 80 тыс http://jenke.rs/Ke7n8V,#коронавирус
ACHTUNG PARTISANEN,@EuropeanFront,28 мая 2020 г.,В Перу зафиксировали рекордный суточный рост случаев COVID-19 https://achtungpartisanen.ru/v-peru-zafiksirovali-rekordnyy-sutochnyy-rost-sluchaev-covid-19/…,
Pekвием по РФ #FreeNavalny #НЕТВОЙНЕ,@RuFailedState,28 мая 2020 г.,"Владелец «Крокус Экспо» Араз Агаларов, находящийся в санкционном списке США, получил уже 2-й госконтракт на размещение больных на сумму 880 000 000 руб. (первый контракт был оценен в 1.1 миллиарда руб.) по временному госпиталя для инфицированных COVID-19",
НАТЕ,@1937987e,28 мая 2020 г.,"Как правильно подгонять статистику - да не хер делать ""если у человека оказался положительный тест на covid-19, но нет жалоб, то теперь такие граждане не подлежат учету в статистике заболеваемости. """,
Blog Turismo Sustentabilidade,@BlogTurS,28 мая 2020 г.,"предложения и скидки при бронировании гостиниц различных категорий, от пятизвездочных до недорогих https://tr.im/1wGLp #travel #trip #hotel #viagem #covid19 #turismo",#covid #covid19
Москва 24,@infomoscow24,28 мая 2020 г.,,
РЕН ТВ | Новости,@rentvchannel,28 мая 2020 г.,"Вирусолог Александр Лукашев заявил, что смертность от COVID-19 в Москве начнет снижаться через неделю. ",
RTVI US,@RTVi,28 мая 2020 г.,Еще 71 пациент с коронавирусом умер в Москве. С начала эпидемии общее число умерших от COVID-19 в столице достигло 2254 человек,
IBTimes.ru,@IbtimesRUS,28 мая 2020 г.,Лавров заявил о готовности России помочь зарубежным странам в борьбе с COVID-19,
Вести 365 Новости,@twit48aa,28 мая 2020 г.,Без жалоб в статистику не включать — рекомендации Минздрава по Covid-19,
Анжела Слободчикова,@Angela_slob,28 мая 2020 г.,Я оценилa городскую новинку «Более 540 доноров сдали плазму для лечения пациентов с COVID-19» в проекте «Активный гражданин»,
Элл,@bagd0s,28 мая 2020 г.,Я оценил городскую новинку «Более 540 доноров сдали плазму для лечения пациентов с COVID-19» в проекте «Активный гражданин»,
@kpru,@kpru,28 мая 2020 г.,"Кого будут считать пациентом с коронавирусом, рассказали в Минздраве",
Ирина Романова,@contact42530360,28 мая 2020 г.,"Медики госпиталя для больных COVID-19 в «Крокус Экспо» пожаловались на нехватку лекарств. На больницу выделили уже 1,9 миллиарда рублей https://meduza.io/feature/2020/05/23/mediki-gospitalya-dlya-bolnyh-covid-19-v-krokus-ekspo-pozhalovalis-na-nehvatku-lekarstv-na-bolnitsu-vydelili-uzhe-1-9-milliarda-rubley…",
IBTimes.ru,@IbtimesRUS,28 мая 2020 г.,Число заболевших COVID-19 на Сахалине перевалило за восьмой десяток,
sololaki,@sololaki1,28 мая 2020 г.,#Новости | Число заболевших COVID-19 на Сахалине перевалило за восьмой десяток https://sololaki.ru/novosti-rossii/novosti-chislo-zabolevshih-covid-19-na-sahaline-perevalilo-za-vosmoy-desyatok.html…,
IBTimes.ru,@IbtimesRUS,28 мая 2020 г.,Еще 71 человек с COVID-19 скончался в Москве,
RusDozorRu,@rusdozor_ru,28 мая 2020 г.,Главврач харьковской больницы о вспышке COVID-19 среди медперсонала: доколе будет этот бардак?,
Коммерсантъ,@kommersant,28 мая 2020 г.,"На фоне отмены Петербургского международного экономического форума (ПМЭФ) из-за пандемии COVID-19 принадлежащая организатору мероприятия фонду «Росконгресс» Business Priority решила инвестировать в киберспорт. Компания выкупила 33,3% Cyber Legacy, к…",
НВ,@tweetsNV,28 мая 2020 г.,"В Минздраве заявили, что 22 июня Украина может выйти на нулевой показатель новых случаев COVID-19",
IBTimes.ru,@IbtimesRUS,28 мая 2020 г.,Число умерших от COVID-19 в США превысило 100 тысяч человек,
Aniq.uz,@AniqUz,28 мая 2020 г.,Венада COVID-19 инфекциясига чалинган беморнинг ўпкасини алмаштириш операцияси ўтказилди https://aniq.uz/y/65923/f,
Церковное Обозрение,@church_review,28 мая 2020 г.,"Под предлогом COVID-19 попытались изменить нашу веру, – иерарх ЭПЦ",
Коммерсантъ,@kommersant,28 мая 2020 г.,"Из-за вызванного пандемией COVID-19 кризиса в новой реальности оказались не только потребители, вынужденные урезать свои расходы, но и ритейлеры. Многим из них пришлось на ходу менять логистические цепочки, чтобы моментально включиться в онлайн-прод…",
Московский Комсомолец,@mkomsomolets,28 мая 2020 г.,"В Дагестане скончались главврач больницы и фельдшер, лечившие больных c COVID-19",
Naspravdi,@_Naspravdi_,28 мая 2020 г.,Шведский эксперимент на грани провала: «стадный иммунитет» запаздывает ,
InterMedia,@intermedia_ru,28 мая 2020 г.,Рецензия: документальный фильм «Music vs COVID-19 World Tour — музыкальная индустрия в условиях панд...,
Росбалт,@rosbaltru,28 мая 2020 г.,,
Ведомости,@Vedomosti,28 мая 2020 г.,Число жертв COVID-19 в США составило к 28 мая 100 047 человек http://vdmsti.ru/bBHw,
ACHTUNG PARTISANEN,@EuropeanFront,28 мая 2020 г.,В Дагестане умерли лечившие больных COVID-19 главврач больницы и фельдшер https://achtungpartisanen.ru/v-dagestane-umerli-lechivshie-bolnyh-covid-19-glavvrach-bolnitsy-i-feldsher/…,
Газета.Ru,@GazetaRu,28 мая 2020 г.,,
ACHTUNG PARTISANEN,@EuropeanFront,28 мая 2020 г.,Лавров: Россия готова помогать зарубежным странам в борьбе с COVID-19 https://achtungpartisanen.ru/lavrov-rossiya-gotova-pomogat-zarubezhnym-stranam-v-borbe-s-covid-19/…,
Литовченко Анастасия,@nastyalito,28 мая 2020 г.,Я оценилa городскую новинку «Более 540 доноров сдали плазму для лечения пациентов с COVID-19» в проекте «Активный гражданин»,
Masha,@arctic_lanes,28 мая 2020 г.,"Наибольшая смертность от COVID-19 наблюдается среди мужчин. Возможно, это связано с тем, что высокий уровень тестостерона может подавлять иммунные реакции, что приводит к более тяжелому течению болезни. Кроме того, у женщин вырабатывается на 20-25% больше антител к SARS-CoV-2",
В Дегунино,@VDegunino,28 мая 2020 г.,"Государь милостив: к #ГОЛОСОВАНИЕ #ОБНУЛИСЬ! #Конституция #РФ подбросил деньжат, закрывшие #ИП безработные получат ЦЕЛЫХ 12130 руб с 1 мая, 45% из 1,9 млн безработных получат по 4,5 тыс руб",
РЕН ТВ | Новости,@rentvchannel,28 мая 2020 г.,За прошедшие сутки в Москве от коронавируса скончались 71 человек. Общее число умерших от COVID-19 составляет 2254:,
SKV,@skv39,28 мая 2020 г.,"Число инфицированных коронавирусом россиян, у которых заболевание протекает без клинических симптомов, увеличилось до 50% от общего числа случаев COVID-19.",
Pressapro.ru,@pressapro,28 мая 2020 г.,В Дагестане умерли лечившие больных COVID-19 главврач больницы и фельдшер https://pressapro.ru/proisshestviya/v-dagestane-ymerli-lechivshie-bolnyh-covid-19-glavvrach-bolnicy-i-feldsher/…,
Mariya Yelina,@Mariya_Yelina,28 мая 2020 г.,Я оценилa городскую новинку «Более 540 доноров сдали плазму для лечения пациентов с COVID-19» в проекте «Активный гражданин»,
Ридус,@RidusNews,28 мая 2020 г.,Еще 71 пациент с COVID-19 умер в Москве,
ZN.UA Зеркало недели,@zn_ua,28 мая 2020 г.,Последние исследования показали небезопасность применения этого препарата,
RTVI US,@RTVi,28 мая 2020 г.,"Число жертв коронавируса в США превысило 100 тысяч человек. В стране выявили больше 1,6 млн случаев COVID-19",
Gazeta-bam.ru,@gazetaBAM,28 мая 2020 г.,Амурская область на четвертом месте по коэффициенту летальностей от COVID-19 в ДФО http://gazeta-bam.ru/news/media/2020/5/28/amurskaya-oblast-na-chetvertom-meste-po-koeffitsientu-letalnostej-ot-covid-19-v-dfo/…,
ZN.UA Зеркало недели,@zn_ua,28 мая 2020 г.,Россия пытается добиться отмены санкций в ООН,
ГлавТвит,@GlavTW,28 мая 2020 г.,Российский врач заявил о гонке стран за вакциной от COVID-19,
KP.RU - Красноярск,@krskkpru,28 мая 2020 г.,"Количество зараженных коронавирусом в Красноярске и крае на 28 мая 2020 года: заразились 3700, вылечили 791",
KP.RU - Красноярск,@krskkpru,28 мая 2020 г.,"Коронавирус в Красноярске и крае, последние новости на сегодня, 28 мая 2020 года: в магазины только в масках, больше коек для пациентов с COVID-19",
Ioanna Abrosimova,@IoannaSeaStar,28 мая 2020 г.,#карантинныйсписок ,
presshub_ru,@presshubeu,28 мая 2020 г.,Санкт-Петербург  [iz] В  #Петербурге от  #Covid-19 вылечились 30% заболевших http://presshub.eu/ru/articledetails.aspx?aid=6807688&pg=1#presshubeu…,#covid #covid-19
ИА REGNUM,@IA_REGNUM,28 мая 2020 г.,В Москве за сутки скончался 71 пациент с заболеванием COVID-19 https://regnum.ru/news/2963995,
ИА REGNUM,@IA_REGNUM,28 мая 2020 г.,В США число умерших с COVID-19 превысило 100 тысяч https://regnum.ru/news/2963994,
Кавказский Узел,@caucasianknot,28 мая 2020 г.,За последние сутки на Южном Кавказе выявлено 544 случая инфицирования коронавирусом.,
Кавказский Узел,@caucasianknot,28 мая 2020 г.,"Власти Чечни анонсировали второй этап отмены карантинных ограничений, однако спикер парламента республики #МагомедДаудов объявил о продлении режима самоизоляции.",
Sergei S.,@vsyo,28 мая 2020 г.,В ответ ,
Ведомости,@Vedomosti,28 мая 2020 г.,Общее число умерших от COVID-19 в столице достигло 2254 человек http://vdmsti.ru/bBHk,
ACHTUNG PARTISANEN,@EuropeanFront,28 мая 2020 г.,"Лавров рассказал, как Запад пытается воспользоваться пандемией COVID-19 https://achtungpartisanen.ru/lavrov-rasskazal-kak-zapad-pytaetsya-vospolzovatsya-pandemiey-covid-19/…",
KP_Yaroslavl,@KP_Yaroslavl,28 мая 2020 г.,"Коронавирус в Ивановской области, последние новости на 28 мая: 48 человек в Плесском доме престарелых заразились COVID-19",
Bender!А,@MrChe76488221,28 мая 2020 г.,В ответ ,
Новости мира,@ubop_net_ua,28 мая 2020 г.,В Новой Зеландии выписали из больниц всех пациентов с COVID-19 - http://ubop.net.ua/v-novoi-zelandii-vypisali-iz-bolnic-vseh-pacientov-s-covid-19/…,
А_Блэк,@Alex_12Black,28 мая 2020 г.,Минздрав рекомендовал не включать в статистику больных COVID-19 без жалоб: https://rbc.ru/society/27/05/2020/5ece9ab49a7947e3ba3072fc… с помощью ,
Новости мира,@ubop_net_ua,28 мая 2020 г.,США из-за COVID-19 на месяц раньше выведут войска из Афганистана - http://ubop.net.ua/ssha-iz-za-covid-19-na-mesiac-ranshe-vyvedyt-voiska-iz-afganistana/…,
Vad,@Vad20053011,28 мая 2020 г.,30 фильмов от the Atlantic.  ,
Гоша Перочинный,@GoshaPerochinny,28 мая 2020 г.,Кредитованию #COVID2019/#коронавирус не страшен...,#covid #коронавирус
Савицкий Андрей Юрич,@uprav_dom,28 мая 2020 г.,Чё?,
V Z - Взгляд,@vzglyad,28 мая 2020 г.,Франция запретила лечить COVID-19 гидроксихлорохином https://vz.ru/news/2020/5/27/1041764.html…,
Петербургский Дневник,@dnevnikspb,28 мая 2020 г.,"Главврач поликлиники №38 заявил, что все сотрудники получили выплаты за работу с больными COVID-19.",
Batsuuri Dugarjav,@BatsuuriDugarj1,28 мая 2020 г.,"АНУ-д COVID-19 ын улмаас нас барсан хүний тоо 100,000 давж халдвар авсан хүний тоо 1,741,760.",
mBit,@milaBitcoin,28 мая 2020 г.,Эксперт: желание быстро создать вакцину от COVID-19 не должно влиять на ее безопасность https://lifestylenotes.ru/raznoe/ekspert-jelanie-bystro-sozdat-vakciny-ot-covid-19-ne-doljno-vliiat-na-ee-bezopasnost/…,
сергей,@rebus454,28 мая 2020 г.,В ответ ,
Константин,@kostia7777777,28 мая 2020 г.,Twitter,
Russia at the United Nations,@RussiaUN,28 мая 2020 г.,,
"Реклама бесплатно и заработок в интернете, Money",@zarobokmoney,28 мая 2020 г.,COVID-19: в ожидании «второй волны» http://money7777.info/?p=16100,
ACHTUNG PARTISANEN,@EuropeanFront,28 мая 2020 г.,Эксперт: желание быстро создать вакцину от COVID-19 не должно влиять на ее безопасность https://achtungpartisanen.ru/ekspert-zhelanie-bystro-sozdat-vaktsinu-ot-covid-19-ne-dolzhno-vliyat-na-ee-bezopasnost/…,
KP.RU - Волгоград,@kp_vlg,28 мая 2020 г.,"Коронавирус в Волгограде, последние новости на 28 мая: в Урюпинске вспышка COVID-19 в психинтернате",
Texnoplus.ru,@texnoplusnews,28 мая 2020 г.,10 советов для удаленной работы даже после пандемии,
Business Mir,@Business_Mir,28 мая 2020 г.,Отмена карантинных мер в #Швейцария произойдет раньше запланированного,
ZdravMedInfo,@ZdravMedInfo,28 мая 2020 г.,Роспотребнадзор обновил правила лабораторного тестирования на COVID-19 http://zdravmedinfo.com/mednews.html?article=146805…,
Смотри HD online,@Kino_HD_Online,28 мая 2020 г.,Маски обязательны при любом выходе из дома: Москва меняет режим самоизоляции ,
Jenkers News (RUS),@jenkers_ru,28 мая 2020 г.,Рано говорить о стадном иммунитете — о тестировании на антитела к #COVID-19 http://jenke.rs/Xv61Vk,#covid #covid-19
pagesmoldova,@pagesmoldova,28 мая 2020 г.,В Тирасполе начали проверять на COVID-19 чиновников https://pages.md/v-tiraspole-nachali-proveriat-na-covid-19-chinovnikov/…,
ZdravMedInfo,@ZdravMedInfo,28 мая 2020 г.,"Выпущены тесты, определяющие степень иммунитета к COVID-19 http://zdravmedinfo.com/mednews.html?article=146785…",
