Имя пользователя,Ссылка,Время,Текст,Хэштеги
Алексей,@_Denver79,21 апр. 2020 г.,"мда.. Цирк, а не карантин ",
ppfood,@ppfoodru,21 апр. 2020 г.,Песков прокомментировал борьбу с COVID-19 в регионах РФ - http://ppfood.ru/peskov-prokommentiroval-borbu-s-covid-19-v-regionax-rf/…,
InterMax,@IntermaxFun,21 апр. 2020 г.,"Шмыгаль доложил президенту, что пик заболеваемости COVID-19 ожидается в начале мая https://intermax.fun/shmygal-dolozhil-prezidentu-chto-pik-zabolevaemosti-covid-19-ozhidaetsya-v-nachale-maya/…",
один в поле не номер,@freedomcry,21 апр. 2020 г.,В ответ ,
Совершенно Cекретно,@SovSekretno,21 апр. 2020 г.,"Чему надо странам учиться у «тоталитарного» Китая в борьбе с COVID-19, читайте в материале «Совершенно секретно»",
Олег Соловьев,@soloviev66,21 апр. 2020 г.,"Чему надо странам учиться у «тоталитарного» Китая в борьбе с COVID-19, читайте в материале «Совершенно секретно»",
RuNews24.ru Новости,@runews24ru,21 апр. 2020 г.,Вирусолог сравнил пандемию коронавируса и эпидемию Эбола,
Аяз Арзыматов,@Ayaz_Arz,21 апр. 2020 г.,"Турция ,Армения ,Грузия ,Горы ",
Смоленская область,@press_smolobl,21 апр. 2020 г.,О внесении изменений в Указ Губернатора Смоленской области «О введении режима повышенной готовности»,
Лучи Бобра,@Max82206006,21 апр. 2020 г.,В ответ ,
Город Днепр,@dneprcity,21 апр. 2020 г.,Шмыгаль - Зеленскому: пик заболеваемости COVID-19 ожидается в начале мая - https://dneprcity.net/politics/shmygal-zelenskomu-pik-zabolevaemosti-covid-19-ozhidaetsya-v-nachale-maya/… #Днепр #Дніпро,
KonstantiN,@REFLEXiON_ONLY,21 апр. 2020 г.,"Известный математик о том, почему пандемия COVID-19 — это лишь репетиция бактериологической войны и каким будет мир после...",
25% - Roman,@Wh0Know5,21 апр. 2020 г.,Кремль готовится к худшему: холодильник начинает побеждать телевизор https://youtu.be/0X9KvE5BD04 через ,
News.mn,@News_mn,21 апр. 2020 г.,"""COVID-19""-ийн улмаас УБТЗ хөрөнгө оруулалтаа 40 хувиар танажээ https://news.mn/r/2290052/?utm_source=twitter&utm_medium=social&utm_campaign=News.MN+Twitter…",
Чикен нагенс,@shutupiamgod,21 апр. 2020 г.,Фото в цвете: бригада СМП едет на вызов к пациенту с covid-19,
bitmakler.io,@bitmaklerio,21 апр. 2020 г.,Компания MicroBT выпустила свою серию майнеров со скоростью 100 TH/s. Кажется это начало конкурентной борьбы компании с Bitmain.  #Bitcoin #Bitmain #COVID19 #Hashrate #M30 #MicroBT #mining #MS30S+ #MS30S++ #S19PRO #S7 #S9 https://bitmakler.io/poyavilos-novoe-oborudovanie-dlya-majninga-bitkoina/…,#covid #covid19
Pulsing Org,@FundPulsing,21 апр. 2020 г.,Технология CRISPR мобилизована для быстрой диагностики COVID-19 http://shop.pulsing.org/tehnologiya-crispr-mobilizovana-dlya-bystroj-diagnostiki-covid-19/…,
Wayk Dalsky,@Wayk07,21 апр. 2020 г.,"По словам Гинцбурга, специалисты центра проанализировали около 200 сывороток крови, взятых у людей, переболевших COVID-19. ",
Росбалт,@rosbaltru,21 апр. 2020 г.,,
Vyacheslav Boyko,@bvn13,21 апр. 2020 г.,Добавил в графики дельты по показателям #covid #covid19 #covid19russia http://covid19.bvn13.com,#covid #covid19
Газета.Ru,@GazetaRu,21 апр. 2020 г.,,
24topkz,@24topkz,21 апр. 2020 г.,В Северной Осетии прогнозируют рост числа зараженных COVID-19 после митинга http://24top.kz/incidents/v-severnoj-osetii-prognozirujut-rost-chisla-zarazhennyh-covid-19-posle-mitinga/…,
ИА Регион-центр,@region_center,21 апр. 2020 г.,В Рязанской области ушли из жизни два человека подтвержденным COVID-19,
paranormal-news,@paranormnews,21 апр. 2020 г.,Коронавирус мог перейти людям от огромных бамбуковых крыс #крыса #китай #коронавирус http://paranormal-news.ru/news/koronavirus_mog_perejti_ljudjam_ot_ogromnykh_bambukovykh_krys/2020-04-21-16820…,#коронавирус
Мир 24,@Mir24TV,21 апр. 2020 г.,На 22 и 23 апреля для вывоза россиян из Бангкока запланированы три рейса,
Годами проверенная наивность,@Tanuf_ka_,21 апр. 2020 г.,Рубрика: Must have апреля,
Мир 24,@Mir24TV,21 апр. 2020 г.,В Узбекистане запустят процесс смягчения карантинных мер. Президент Мирзиеев распорядился сделать это в ряде регионов для восстановления экономики страны.,
Anna,@_auslanderin,21 апр. 2020 г.,Итоги дня в Германии: ,
Expat,@LonelyExpat_,21 апр. 2020 г.,"Вирусы на основе РНК, такие как SARS-CoV-2 -вызывающие заболевание COVID-19 заражённый им вырабатывает  антитела в первые три недели эта защита длится только несколько месяцев",
Павел Шугайло,@PavelShugailo49,21 апр. 2020 г.,"""Делай, как мы!"" Как белорусы помогают врачам в борьбе с COVID-19 https://youtu.be/LarhkBcLtCw с помощью ",
LVPapy,@LVPapy,21 апр. 2020 г.,"И про #стандарты интересная тз..Только учет всех проф.тз. может дать ответ и путь решения наиболее оптимальный?)( Игорь Алексеевич уже неоднократно заявлял в #СМИ о том, что ..и для борьбы с #пандемия было бы вполне достаточно общих рекомендаций, как и при любых #ОРВИ.Но, посколь",#пандемия
Андрей Отинов,@Otinoff,21 апр. 2020 г.,Заболел коронавирусом начальник Генерального штаба Италии https://onff.ru/?p=1017&utm_source=ReviveOldPost&utm_medium=social&utm_campaign=ReviveOldPost… #италия #коронавирус,#коронавирус
УМВД Приморья,@primuvd,21 апр. 2020 г.,Госавтоинспекция Приморья информирует о состоянии аварийности в период режима самоизоляции https://25.мвд.рф/news/item/2001--p1ai/news/item/20011397…,
Анастасия Курбатова,@anastasiackurba,21 апр. 2020 г.,"За последние сутки в мире зарегистрировано 65.5 тысяч новых случаев COVID-19, умерли 5,102 больных http://dlvr.it/RV7hmR",
РИА Новости,@rianru,21 апр. 2020 г.,,
LVPapy,@LVPapy,21 апр. 2020 г.,"Тоже #интересно #точка_зрения #COVID19 #Гундаров И.А.— д.м.н, специалист в области эпидемиологии и профилактической медицины,#демографии, социальной психологии, философии, главный научный сотрудник НИИ #общественного_здоровья и здравоохранением Московской",#covid #covid19
IBTimes.ru,@IbtimesRUS,21 апр. 2020 г.,В ЦНИИ эпидемиологии назвали примерные даты выхода на пик заболеваемости COVID-19 в России,
Checheninfo,@Checheninfo,21 апр. 2020 г.,ЧЕЧНЯ. Более 400 медработников ЧР пройдут обучение по оказанию помощи больным с COVID-19.,
Вести 365 Новости,@twit48aa,21 апр. 2020 г.,"Мишустин заявил, что на Камчатке плохо осваивают деньги на борьбу с COVID-19 https://goo.gl/fb/sGhdkn",
Alexey,@Alekzzzzz,21 апр. 2020 г.,Сингапур резко рванул вверх по заболеваемости COVID-19 - а сначала их хвалили за эффективный карантин,
Белновости,@BelnovostiBy,21 апр. 2020 г.,"Названы грозные симптомы COVID-19, при которых обязательно нужно вызвать скорую",
MIGnews,@mignewsfeed,21 апр. 2020 г.,COVID-19: мировые звезды спели в поддержку медиков:,
Verenwolf,@roadnether,21 апр. 2020 г.,"Не понимаю большинства воплей о covid-19. Темп распространения в РФ снижается, и я не о сегодняшних десяти процентах, а о пятнадцати на предыдущей неделе (до того было 20+). Я не знаю и боюсь предполагать, что будет дальше, мне просто непонятно, как взрослые люди умудряются",
Misha Komadovsky,@komadovsky,21 апр. 2020 г.,Губернатор Мэриленда ,
Iva,@IvaMartiskainen,21 апр. 2020 г.,"4) Новое исследование, проведенное учеными из Школы общественного здравоохранения имени Джона Хопкинса, показывает, что среднее время появления симптомов составляет около пяти дней. Также возможно иметь COVID-19 с минимальными или вообще без симптомов.",
Iva,@IvaMartiskainen,21 апр. 2020 г.,"3) - поверхностное дыхание, проблемы с дыханием",
Iva,@IvaMartiskainen,21 апр. 2020 г.,"1) для тех, кому интересно, я публикую информацию, доступную на сайте Johns Hopkins Bloomberg school of public health касательно симптомов #COVID19 ",#covid #covid19
Misha Komadovsky,@komadovsky,21 апр. 2020 г.,"В рабочей группе по борьбе с коронавирусом в США говорят, что ",
Коммерсантъ Политика,@kmrspolitics,21 апр. 2020 г.,"20 апреля президент России Владимир Путин провел совещание, посвященное санитарно-эпидемиологической обстановке в стране. На нем сначала выяснилось, что в ближайшее время вакцина против COVID-19 не появится.",
24topkz,@24topkz,21 апр. 2020 г.,В Россельхознадзоре напомнили о риске передачи COVID-19 от кошки кошке http://24top.kz/society/v-rosselhoznadzore-napomnili-o-riske-peredachi-covid-19-ot-koshki-koshke/…,
Вэл Коп,@Vel_Kop,21 апр. 2020 г.,Блокбастер мирового закулисья: «Тесты на COVID-19 оказались заражены!» | InfoRuss https://inforuss.info/blokbaster-mirovogo-zakulisya/?_utl_t=tw…,
Bentli,@Bentli39669689,21 апр. 2020 г.,В ответ ,
Артем Обычный,@Archilive13,21 апр. 2020 г.,"Мне кажется если щас еще больше упадет цена за барель, Росия будет сасать, COVID-19 ебанет 1/3 населения, кризис, гражданская разруха, будем есть богатых  ",
Misha Komadovsky,@komadovsky,21 апр. 2020 г.,"Вице-президент Пенс говорит, что у США есть достаточно возможностей для тестирования на коронавирус, чтобы начать первую фазу открытия экономики. ",
Вадим Петряев,@vadila87,21 апр. 2020 г.,"#карантин да #подушкачеллендж  сорян, без пояска... А если быть честным, заебалось сидеть дома!  #pillowchallenge #stayhome #covid19 @ Moscow, Russia https://instagram.com/p/B_OFS5_DvBk/?igshid=9j6zn5p4uzo…",#covid #covid19
Bentli,@Bentli39669689,21 апр. 2020 г.,"Дыма без огня не бывает.На Рация 6 Сентября 2019 г. в НОВОСИБИРСКЕ  лаболатории разработки COVID 19 произошол взрыв,в то время была там делегация с Китая города Ухань.100 % этот вирус произошол с на РАЦИЯ да же к маме не ходи.",
Kratko-News.com,@kratkonewscom,21 апр. 2020 г.,21/04/2020 Губернатор Севастополя обнародовал ужасающий вид легких первого зараженного COVID-19 Краткие новости https://kratko-news.com/2020/04/21/gubernator-sevastopolya-obnarodoval-uzhasayushhij-vid-legkix-pervogo-zarazhennogo-covid-19/…,
Известия,@izvestia_ru,21 апр. 2020 г.,,
Говорящие новости,@NSN_fm,21 апр. 2020 г.,"В России упростили беспошлинный ввоз на медицинские товары, предназначенные для борьбы с коронавирусом COVID-19",
KOLYMAWEB,@kolymaweb,21 апр. 2020 г.,Компания «Полюс» продолжает реализовывать мероприятия для предотвращения распространения COVID-19 на территории Магаданской области,
Медоед,@arhaim1,21 апр. 2020 г.,В ответ ,
Dr. Elena Mikhailova,@ElenaMikhailova,21 апр. 2020 г.,"В Канаде ищут доноров плазмы переболевших #COVID19 , сообщает ",#covid #covid19
Баба Яга Сергеевна,@YuliaRakov,21 апр. 2020 г.,В ответ ,
КАТЕРИНА,@C5eGZBiicZ3xe4g,21 апр. 2020 г.,"Меркель опасается, что граждане ФРГ перестанут выполнять требования властей по COVID-19 https://polit.info/492976-merkel-opasaetsya-chto-grazhdane-frg-perestanut-vypolnyat-trebovaniya-vlastei-po-covid-19?utm_medium=email&utm_source=UniSender&utm_campaign=231840781#.Xp4jtewpU7k.twitter…",
Левон Гнуни,@levongnuni1,21 апр. 2020 г.,Немецкие ученые о COVID-19. Крематории в  Китае. https://youtu.be/10mR_5qXCYU с помощью ,
Горячая линия ДНР,@HotlineDNR,21 апр. 2020 г.,РФ доставила из КНР в Молдавию медоборудование для борьбы с COVID-19,
Сатико,@ksatico,21 апр. 2020 г.,Итоги 19 и 20 апреля,
Maks Довгер,@NonoOndajoven,21 апр. 2020 г.,В России клинические испытания вакцины от COVID-19 начнут в июне,
КАТЕРИНА,@C5eGZBiicZ3xe4g,21 апр. 2020 г.,Глава Минздрава РФ высоко оценил эффективность самоизоляции на фоне COVID-19 https://polit.info/492965-glava-minzdrava-rf-vysoko-ocenil-effektivnost-samoizolyacii-na-fone-covid-19?utm_medium=email&utm_source=UniSender&utm_campaign=231840781#.Xp4jRNwFsK4.twitter…,
марта янич,@1015_ast,21 апр. 2020 г.,Блокбастер мирового закулисья: «Тесты на COVID-19 оказались заражены!»,
real Anarchist,@veganarch,21 апр. 2020 г.,В ответ ,
otto UKROP,@OttoHammond,21 апр. 2020 г.,Врач из Израиля назвал главную причину заражения медиков COVID-19 •  #Україна  http://antikor.com.ua/articles/374584-vrach_iz_izrailja_nazval_glavnuju_prichinu_zarahenija_medikov_covid-19…,
о'Yuna,@Yuna318,21 апр. 2020 г.,"500 дахь дагагчтайгаа coffee уунаа гэдэг бол би  500 дагагчтайгаа уух байсын, даанч covid 19 гээд ... хуулиа л дагахаас ...",
CryptoWiki,@wiki_crypto,21 апр. 2020 г.,Блокчейн в борьбе с пандемией COVID-19 и другие инициативы с использованием технологии https://cryptowiki.ru/article/blokchein-v-borbe-s-pandemiei-covid-19-i-drygie-iniciativy-s-ispolzovaniem-tehnologii.html…,
Zloy Enot,@Zloy_Enot_777,21 апр. 2020 г.,Коронавирус COVID-19: главные события 20 апреля http://coronaviruse.ru/%d0%ba%d0%be%d1%80%d0%be%d0%bd%d0%b0%d0%b2%d0%b8%d1%80%d1%83%d1%81-covid-19-%d0%b3%d0%bb%d0%b0%d0%b2%d0%bd%d1%8b%d0%b5-%d1%81%d0%be%d0%b1%d1%8b%d1%82%d0%b8%d1%8f-20-%d0%b0%d0%bf%d1%80%d0%b5%d0%bb/…,
IBTimes.ru,@IbtimesRUS,21 апр. 2020 г.,Адвокат летчика Ярошенко сообщил о смерти его сокамерника от COVID-19 :: Политика :: РБК,
Vegatur,@vegatur1,21 апр. 2020 г.,"Кума с ВОЗа, миру легче",
Ольга (OLXO),@olxo2013,21 апр. 2020 г.,"В ВШЭ заявили об ""удивительном"" уровне смертности от COVID-19 в России: https://ria.ru/20200421/1570324324.html…",
ИА REGNUM,@IA_REGNUM,21 апр. 2020 г.,В Марокко выявили за сутки 191 случай заболевания COVID-19 https://regnum.ru/news/2923195,
Hakimiyyət qəzeti,@Hakimiyetqazeti,21 апр. 2020 г.,В Москве скончались 29 пациентов с коронавирусом — Российская газетаВ Москве скончались 29 пациентов с коронавирусом. Об этом сообщает оперативный штаб по контролю и мониторингу ситуации с COVID-19. У всех была пневмония и положительный результат тесто...,
strelkov_maxim81,@SMaxim81,21 апр. 2020 г.,Закрытие многих агентств недвижимости и снижение цен на жилье прогнозируют в Испании. https://zen.yandex.ru/media/id/5da233301ee34f7325299b2c/zakrytie-mnogih-agentstv-nedvijimosti-i-snijenie-cen-na-jile-prognoziruiut-v-ispanii-5e9daf4d0596fe5c972fda5d…,
FinancerRU,@FinancerRussia,21 апр. 2020 г.,Собрали всю информацию о материальной помощи и льготах на весну/лето 2020 года.,
Kartridg MSK,@KartridgMsk,21 апр. 2020 г.,"Компания Ricoh Company, Ltd особенно внимательно следит за ситуацией, касающейся распространения коронавируса (Covid-19).",
TOP Studio,@topstud_io,21 апр. 2020 г.,Динамика e-commerce рынка в период массовой самоизоляции,
Fox,@Fox04208261,21 апр. 2020 г.,Одно я вам могу сказать точно: ,
Сергей Трик,@ProstoTric,21 апр. 2020 г.,"Как показывают события, человечество должно пересмотреть отношение к мировой экономической и политической системам. Как варик социализм (здорового человека) или технократия. В ином случае нас ждёт участь динозавров...",
otto UKROP,@OttoHammond,21 апр. 2020 г.,"На утро 20 апреля зафиксирован 261 новый случай COVID-19 в Украине, всего - 5710, умерли 151 человек, 359 - выздоровели, - Минздрав #Україна https://censor.net.ua/n3190160",
Misha Komadovsky,@komadovsky,21 апр. 2020 г.,"Трамп подчеркивает, что показатели по количеству проведенных тестов удваиваются с каждой неделей. Демонстрирует список мест, где можно сдать анализ на коронавирус. Их, говорит Трамп, 5 тысяч.",
otto UKROP,@OttoHammond,21 апр. 2020 г.,"На утро 20 апреля зафиксирован 261 новый случай COVID-19 в Украине, всего - 5710, умерли 151 человек, 359 - выздоровели, - Минздрав https://censor.net.ua/n3190160",
Новости УрФО,@naUrFOru,21 апр. 2020 г.,"Центр реабилитации на Смолино превратили во временный обсерватор по COVID-19 | Новости УрФО, Челябинск http://naurfo.ru/news/53468",
Checheninfo,@Checheninfo,21 апр. 2020 г.,ЧЕЧНЯ. Кадыров проведал больных COVID-19.,
01eg (Запасний) ХронікаНашогоПиzдецю,@080301eg,21 апр. 2020 г.,Во Львовской области обнаружили уже 253 случая COVID-19,
TOP Studio,@topstud_io,21 апр. 2020 г.,Треть пользовательской аудитории ждёт позитива от рекламы в период пандемии,
GV по-русски,@gvrussian,21 апр. 2020 г.,Дневники COVID-19 из Уханя: ограничения ужесточаются https://ift.tt/3al73M1,
Арт Стекло,@Ceramdec,21 апр. 2020 г.,Немецкая Бундеслига может возобновиться уже 9 мая,
TOP Studio,@topstud_io,21 апр. 2020 г.,Из-за Covid-19 популярность Telegram значительно возросла,
Кавказский Узел,@caucasianknot,21 апр. 2020 г.,#Новоевблоге: #Митинг во Владикавказе и параллель с Степанакертом.,
ТетянаЧорна,@chernayaT_3,21 апр. 2020 г.,В ответ ,
RusDozorRu,@rusdozor_ru,21 апр. 2020 г.,"В Ровенской области коронавирус повторно выявили у пациентов, готовившихся к выписке",
Новости NewsTes,@xpshiscoa,21 апр. 2020 г.,"В ВШЭ заявили об ""удивительном"" уровне смертности от COVID-19 в России  https://newstes.ru/2020/04/21/v-vshje-zajavili-ob-udivitelnom-urovne-smertnosti-ot-covid-19-v-rossii.html…",
LVPapy,@LVPapy,21 апр. 2020 г.,"И правильно говорил #Президент #РФ в обращении..нужно свой путь и выход из #COVID19 искать и находить..вырабатывать ..наверное путём ..и мнения умнейших людей, докторов, вирусологов..Ведь и доктор Рошаль говорит многое и важное.чтобы снизить отрицательные последствия максимально.",#covid #covid19
Tursunbay Bakir uulu,@bakiruulu,21 апр. 2020 г.,Ударим юмором по #coronavirus !,
Белновости,@BelnovostiBy,21 апр. 2020 г.,Коронавирус COVID-19. Последние новости на 21 апреля 00:00,
Московский Комсомолец,@mkomsomolets,21 апр. 2020 г.,Скворцова объяснила выявление 6 тыс. случаев заражения COVID-19 за день https://mk.ru/social/2020/04/21/skvorcova-obyasnila-vyyavlenie-6-tys-sluchaev-zarazheniya-covid19-za-den.html…,
Москва 24,@infomoscow24,21 апр. 2020 г.,,
A.Ponukalov,@APonukalov,21 апр. 2020 г.,Деятельность российской разведки в Италии оплатили итальянские налогоплательщики https://zloy-odessit.livejournal.com/3122031.html?utm_source=twsharing&utm_medium=social… #коронавирус #Россия #Италия,#коронавирус
Maxim It’s me,@Marijuana5,21 апр. 2020 г.,Реассортация — Википедия | #Вирусы #Наука #Вирусология #Коронавирус #Генетика #ДНК   https://ru.wikipedia.org/wiki/%D0%A0%D0%B5%D0%B0%D1%81%D1%81%D0%BE%D1%80%D1%82%D0%B0%D1%86%D0%B8%D1%8F…,#коронавирус
MIGnews,@mignewsfeed,21 апр. 2020 г.,"""Стражи галактики 3"" не будут переносить из-за COVID-19:",
A.Ponukalov,@APonukalov,21 апр. 2020 г.,Пасхальный шабаш Московского патриархата или про террористов в рясах https://zloy-odessit.livejournal.com/3121763.html?utm_source=twsharing&utm_medium=social… #коронавирус #РПЦ #Украина #терроризм,#коронавирус
